nsqf_level,required_skills,next_level
1,basic reading writing communication awareness,2
2,basic tools safety operations foundational basics,3
3,wiring tools basic computer operating entry level tasks,4
4,advanced wiring intermediate domain knowledge independent work,5
5,specialized tools technical expertise complex tasks,6
6,management supervision advanced domain knowledge leadership,7
7,strategic planning leadership specialized strategic role,8
8,research design master level expertise innovation,
